"310M500US49020","Winchester, VA-WV Metro Area","137621","*****",
"310M500US49180","Winston-Salem, NC Metro Area","666216","*****",
"310M500US49340","Worcester, MA-CT Metro Area","941338","*****",
"310M500US49420","Yakima, WA Metro Area","249697","*****",
"310M500US49500","Yauco, PR Metro Area","90618","*****",
"310M500US49620","York-Hanover, PA Metro Area","445565","*****",
"310M500US49660","Youngstown-Warren-Boardman, OH-PA Metro Area","541846","*****",
"310M500US49700","Yuba City, CA Metro Area","172469","*****",
"310M500US49740","Yuma, AZ Metro Area","209468","*****",
